{
  "$schema": "https://json-schema.org/draft/2020-12/schema",
  "$id": "https://bearings.dev/schemas/checklist.json",
  "title": "Checklist",
  "$comment": "validate.mjs is the executable authority and additionally enforces globally unique item and sub-item IDs.",
  "type": "object",
  "additionalProperties": false,
  "required": ["title", "summary", "sections"],
  "properties": {
    "title": { "type": "string", "pattern": "\\S" },
    "summary": { "type": "string", "pattern": "\\S" },
    "intro": { "type": "string" },
    "callout": { "type": "string" },
    "conventions": { "type": "string" },
    "sections": {
      "type": "array",
      "minItems": 1,
      "items": { "$ref": "#/$defs/section" }
    }
  },
  "$defs": {
    "codeBlock": {
      "type": "object",
      "additionalProperties": false,
      "required": ["language", "content"],
      "properties": {
        "language": { "type": "string", "pattern": "\\S" },
        "content": { "type": "string" }
      }
    },
    "link": {
      "type": "object",
      "additionalProperties": false,
      "required": ["label", "url"],
      "properties": {
        "label": { "type": "string", "pattern": "\\S" },
        "url": { "type": "string", "pattern": "\\S" }
      }
    },
    "subItem": {
      "type": "object",
      "additionalProperties": false,
      "required": ["id", "title"],
      "properties": {
        "id": { "type": "string", "pattern": "\\S" },
        "title": { "type": "string", "pattern": "\\S" },
        "instruction": { "type": "string" },
        "expectedResult": { "type": "string" },
        "codeBlocks": { "type": "array", "items": { "$ref": "#/$defs/codeBlock" } },
        "links": { "type": "array", "items": { "$ref": "#/$defs/link" } },
        "optional": { "type": "boolean" },
        "warning": { "type": "string" },
        "failureGuidance": { "type": "string" }
      }
    },
    "item": {
      "type": "object",
      "additionalProperties": false,
      "required": ["id", "title"],
      "properties": {
        "id": { "type": "string", "pattern": "\\S" },
        "title": { "type": "string", "pattern": "\\S" },
        "instruction": { "type": "string" },
        "expectedResult": { "type": "string" },
        "codeBlocks": { "type": "array", "items": { "$ref": "#/$defs/codeBlock" } },
        "links": { "type": "array", "items": { "$ref": "#/$defs/link" } },
        "optional": { "type": "boolean" },
        "warning": { "type": "string" },
        "failureGuidance": { "type": "string" },
        "subItems": { "type": "array", "items": { "$ref": "#/$defs/subItem" } }
      }
    },
    "section": {
      "type": "object",
      "additionalProperties": false,
      "required": ["number", "title", "kind", "items"],
      "properties": {
        "number": { "type": "string", "pattern": "\\S" },
        "title": { "type": "string", "pattern": "\\S" },
        "kind": { "enum": ["checklist", "info"] },
        "intro": { "type": "string" },
        "items": {
          "type": "array",
          "minItems": 1,
          "items": { "$ref": "#/$defs/item" }
        }
      }
    }
  }
}
